{
  "schema": "tfpr/plan-result@1",
  "tool": {
    "version": "<version>",
    "runner": "byo",
    "binary": "terraform",
    "binary_version": "1.15.4",
    "plan_format_version": "1.2"
  },
  "target": {
    "stack": "forget",
    "workspace": "default",
    "key": "forget:default"
  },
  "source": {
    "sha": "",
    "tree": "",
    "head_sha": "",
    "pr": null
  },
  "run": {
    "ci": "local",
    "attempt": 0
  },
  "summary": {
    "exit_code": 2,
    "status": "state_only",
    "counts": {
      "create": 0,
      "update": 0,
      "delete": 0,
      "replace": 0,
      "import": 0,
      "forget": 1,
      "move": 0,
      "read": 0,
      "output": 0
    },
    "units": {
      "total": 1,
      "changed": 1,
      "error": 0,
      "not_run": 0,
      "provisional": 0,
      "apply_needed": 1
    }
  },
  "units": [
    {
      "path": ".",
      "exit_code": 2,
      "status": "state_only",
      "counts": {
        "create": 0,
        "update": 0,
        "delete": 0,
        "replace": 0,
        "import": 0,
        "forget": 1,
        "move": 0,
        "read": 0,
        "output": 0
      },
      "resources": [
        {
          "address": "terraform_data.pinned",
          "action": "forget",
          "reason": "delete_because_no_resource_config",
          "mode": "managed"
        }
      ],
      "outputs": [],
      "drift": 0,
      "text_chars": 525,
      "fingerprint": "sha256:49af165839c24796b633cc3559cccdd9a63cc1056d6f47715dc519a738c753f8",
      "planfile": {
        "present": false
      },
      "dependencies": [],
      "state_empty": false,
      "provisional": false,
      "skippable": false
    }
  ],
  "redaction": {
    "mode": "none"
  }
}
