{
  "schema": "tfpr/plan-result@1",
  "tool": {
    "version": "<version>",
    "runner": "byo",
    "binary": "terraform",
    "binary_version": "1.15.4",
    "plan_format_version": "1.2"
  },
  "target": {
    "stack": "envs/\u003cprod\u003e\u0026\"x\"",
    "workspace": "default",
    "key": "envs-prodx:default"
  },
  "source": {
    "sha": "",
    "tree": "",
    "head_sha": "",
    "pr": null
  },
  "run": {
    "ci": "local",
    "attempt": 0
  },
  "summary": {
    "exit_code": 2,
    "status": "changes",
    "counts": {
      "create": 1,
      "update": 1,
      "delete": 1,
      "replace": 1,
      "import": 0,
      "forget": 0,
      "move": 0,
      "read": 0,
      "output": 0
    },
    "units": {
      "total": 1,
      "changed": 1,
      "error": 0,
      "not_run": 0,
      "provisional": 0,
      "apply_needed": 1
    }
  },
  "units": [
    {
      "path": ".",
      "exit_code": 2,
      "status": "changes",
      "counts": {
        "create": 1,
        "update": 1,
        "delete": 1,
        "replace": 1,
        "import": 0,
        "forget": 0,
        "move": 0,
        "read": 0,
        "output": 0
      },
      "resources": [
        {
          "address": "terraform_data.item[\"alpha\"]",
          "action": "update",
          "mode": "managed"
        },
        {
          "address": "terraform_data.item[\"beta\"]",
          "action": "delete",
          "reason": "delete_because_each_key",
          "mode": "managed"
        },
        {
          "address": "terraform_data.item[\"gamma\"]",
          "action": "create",
          "mode": "managed"
        },
        {
          "address": "terraform_data.pinned",
          "action": "replace",
          "reason": "replace_because_cannot_update",
          "mode": "managed"
        }
      ],
      "outputs": [],
      "drift": 0,
      "text_chars": 1238,
      "fingerprint": "sha256:4996f7eb147a2891fdd75aa2b4a5e758a09322814c3297aead7dc2008a933721",
      "planfile": {
        "present": false
      },
      "dependencies": [],
      "state_empty": false,
      "provisional": false,
      "skippable": false
    }
  ],
  "redaction": {
    "mode": "none"
  }
}
