{
  "schema": "tfpr/plan-result@1",
  "tool": {
    "version": "<version>",
    "runner": "byo",
    "plan_format_version": "1.2"
  },
  "target": {
    "stack": "backticks",
    "workspace": "default",
    "key": "backticks:default"
  },
  "source": {
    "sha": "",
    "tree": "",
    "head_sha": "",
    "pr": null
  },
  "run": {
    "ci": "local",
    "attempt": 0
  },
  "summary": {
    "exit_code": 2,
    "status": "changes",
    "counts": {
      "create": 1,
      "update": 0,
      "delete": 0,
      "replace": 0,
      "import": 0,
      "forget": 0,
      "move": 0,
      "read": 0,
      "output": 1
    },
    "units": {
      "total": 1,
      "changed": 1,
      "error": 0,
      "not_run": 0,
      "provisional": 0,
      "apply_needed": 1
    }
  },
  "units": [
    {
      "path": ".",
      "exit_code": 2,
      "status": "changes",
      "counts": {
        "create": 1,
        "update": 0,
        "delete": 0,
        "replace": 0,
        "import": 0,
        "forget": 0,
        "move": 0,
        "read": 0,
        "output": 1
      },
      "resources": [
        {
          "address": "terraform_data.item[\"a```b\"]",
          "action": "create",
          "mode": "managed"
        }
      ],
      "outputs": [
        {
          "name": "item_count",
          "action": "update"
        }
      ],
      "drift": 0,
      "text_chars": 482,
      "fingerprint": "sha256:549730b6cc14433869ed326afee94c094f708c7eea9e5cef5b8227a229096a07",
      "planfile": {
        "present": false
      },
      "dependencies": [],
      "state_empty": false,
      "provisional": false,
      "skippable": false
    }
  ],
  "redaction": {
    "mode": "none"
  }
}
