{
  "schema": "tfpr/plan-result@1",
  "tool": {
    "version": "<version>",
    "runner": "byo",
    "plan_format_version": "1.2"
  },
  "target": {
    "stack": "moves-only",
    "workspace": "default",
    "key": "moves-only:default"
  },
  "source": {
    "sha": "",
    "tree": "",
    "pr": null
  },
  "run": {
    "ci": "local",
    "attempt": 0
  },
  "summary": {
    "exit_code": 2,
    "status": "state_only",
    "counts": {
      "create": 0,
      "update": 0,
      "delete": 0,
      "replace": 0,
      "import": 0,
      "forget": 0,
      "move": 3,
      "read": 0,
      "output": 0
    },
    "units": {
      "total": 1,
      "changed": 1,
      "error": 0,
      "not_run": 0,
      "provisional": 0,
      "apply_needed": 1
    }
  },
  "units": [
    {
      "path": ".",
      "exit_code": 2,
      "status": "state_only",
      "counts": {
        "create": 0,
        "update": 0,
        "delete": 0,
        "replace": 0,
        "import": 0,
        "forget": 0,
        "move": 3,
        "read": 0,
        "output": 0
      },
      "resources": [
        {
          "address": "terraform_data.anchor",
          "previous_address": "terraform_data.pinned",
          "action": "move",
          "moved": true,
          "mode": "managed"
        },
        {
          "address": "terraform_data.entry[\"alpha\"]",
          "previous_address": "terraform_data.item[\"alpha\"]",
          "action": "move",
          "moved": true,
          "mode": "managed"
        },
        {
          "address": "terraform_data.entry[\"beta\"]",
          "previous_address": "terraform_data.item[\"beta\"]",
          "action": "move",
          "moved": true,
          "mode": "managed"
        }
      ],
      "outputs": [],
      "drift": 0,
      "text_chars": 747,
      "fingerprint": "sha256:1d7dab87b37cabc4d2f3dae1ed8150622f7f25ef132de036e7cccff690af8e8b",
      "planfile": {
        "present": false
      },
      "dependencies": [],
      "state_empty": false,
      "provisional": false,
      "skippable": false
    }
  ],
  "redaction": {
    "mode": "none"
  }
}
