{
  "schema": "tfpr/plan-result@1",
  "tool": {
    "version": "<version>",
    "runner": "byo",
    "binary": "terraform",
    "binary_version": "1.15.4",
    "plan_format_version": "1.2"
  },
  "target": {
    "stack": "import-update",
    "workspace": "default",
    "key": "import-update:default"
  },
  "source": {
    "sha": "",
    "tree": "",
    "head_sha": "",
    "pr": null
  },
  "run": {
    "ci": "local",
    "attempt": 0
  },
  "summary": {
    "exit_code": 2,
    "status": "changes",
    "counts": {
      "create": 0,
      "update": 1,
      "delete": 0,
      "replace": 0,
      "import": 1,
      "forget": 0,
      "move": 0,
      "read": 0,
      "output": 0
    },
    "units": {
      "total": 1,
      "changed": 1,
      "error": 0,
      "not_run": 0,
      "provisional": 0,
      "apply_needed": 1
    }
  },
  "units": [
    {
      "path": ".",
      "exit_code": 2,
      "status": "changes",
      "counts": {
        "create": 0,
        "update": 1,
        "delete": 0,
        "replace": 0,
        "import": 1,
        "forget": 0,
        "move": 0,
        "read": 0,
        "output": 0
      },
      "resources": [
        {
          "address": "terraform_data.adopted",
          "action": "update",
          "importing": true,
          "mode": "managed"
        }
      ],
      "outputs": [],
      "drift": 0,
      "text_chars": 544,
      "fingerprint": "sha256:f5fdf1db9d147683fa26486ccf6c0d817ff044e10e4c85ab170737e56febafd5",
      "planfile": {
        "present": false
      },
      "dependencies": [],
      "state_empty": false,
      "provisional": false,
      "skippable": false
    }
  ],
  "redaction": {
    "mode": "none"
  }
}
