{
  "schema": "tfpr/plan-result@1",
  "tool": {
    "version": "<version>",
    "runner": "byo",
    "plan_format_version": "1.2"
  },
  "target": {
    "stack": "no-changes",
    "workspace": "default",
    "key": "no-changes:default"
  },
  "source": {
    "sha": "",
    "tree": "",
    "pr": null
  },
  "run": {
    "ci": "local",
    "attempt": 0
  },
  "summary": {
    "exit_code": 0,
    "status": "no_op",
    "counts": {
      "create": 0,
      "update": 0,
      "delete": 0,
      "replace": 0,
      "import": 0,
      "forget": 0,
      "move": 0,
      "read": 0,
      "output": 0
    },
    "units": {
      "total": 1,
      "changed": 0,
      "error": 0,
      "not_run": 0,
      "provisional": 0,
      "apply_needed": 0
    }
  },
  "units": [
    {
      "path": ".",
      "exit_code": 0,
      "status": "no_op",
      "counts": {
        "create": 0,
        "update": 0,
        "delete": 0,
        "replace": 0,
        "import": 0,
        "forget": 0,
        "move": 0,
        "read": 0,
        "output": 0
      },
      "resources": [],
      "outputs": [],
      "drift": 0,
      "text_chars": 188,
      "fingerprint": "sha256:f13fa1c59cb83003176963af0243b3b94ed2c419d81a47f11b76028513cad939",
      "planfile": {
        "present": false
      },
      "dependencies": [],
      "state_empty": false,
      "provisional": false,
      "skippable": true
    }
  ],
  "redaction": {
    "mode": "none"
  }
}
